{
  "$schema": "../schema/atomic-skill-v1.json",
  "id": "platform-healthcheck",
  "type": "atomic-skill",
  "version": "1.0.0",
  "metadata": {
    "name": "Platform Healthcheck",
    "nameZh": "platform-healthcheck",
    "description": "Skill: platform-healthcheck",
    "descriptionZh": "platform-healthcheck",
    "author": "skills4coder-team",
    "tags": [
      "platform"
    ],
    "category": "atomic"
  },
  "input": {
    "schema": {
      "type": "object",
      "properties": {},
      "required": []
    }
  },
  "output": {
    "schema": {
      "type": "object",
      "properties": {},
      "required": []
    }
  },
  "implementation": {
    "type": "native",
    "function": "platform_healthcheck"
  },
  "errors": {}
}