{
  "$schema": "../schema/atomic-skill-v1.json",
  "id": "tencent-cloud-lighthouse",
  "type": "atomic-skill",
  "version": "1.0.0",
  "metadata": {
    "name": "Tencent Cloud Lighthouse",
    "nameZh": "腾讯云轻量应用服务器",
    "description": "Provision and operate Tencent Cloud Lighthouse instances for small business and prototyping workloads.",
    "descriptionZh": "为中小业务与原型场景开通并运营腾讯云轻量应用服务器。",
    "author": "skills4coder-team",
    "tags": [
      "cloud",
      "tencent",
      "lighthouse",
      "iaas",
      "lightweight"
    ],
    "category": "ops"
  },
  "input": {
    "schema": {
      "type": "object",
      "required": [
        "region"
      ],
      "properties": {
        "region": {
          "type": "string"
        },
        "bundle": {
          "type": "string"
        },
        "image": {
          "type": "string",
          "enum": [
            "ubuntu",
            "centos",
            "debian",
            "wordpress",
            "docker"
          ]
        }
      }
    }
  },
  "output": {
    "schema": {
      "type": "object",
      "properties": {
        "instanceId": {
          "type": "string"
        },
        "publicIp": {
          "type": "string"
        },
        "snapshot": {
          "type": "object"
        }
      }
    }
  },
  "implementation": {
    "type": "native",
    "function": "tencent_cloud_lighthouse"
  },
  "errors": {
    "BUNDLE_UNAVAILABLE": {
      "code": "TCL_001",
      "message": "所选套餐在当前 region 不可用",
      "retryable": false
    }
  },
  "constraints": {
    "permissions": [
      "read"
    ]
  },
  "learning": {
    "summaryZh": "Lighthouse 是腾讯云的\"轻量套餐机\"，便宜上手快，但弹性 / 安全组 / IAM 比 CVM 弱；适合个人站、原型，不适合生产关键链路。",
    "keyPoints": [
      "套餐式计费（不可拆分）",
      "内置防火墙 ≠ 完整 SG",
      "可平滑升级到 CVM",
      "快照与回滚是基本能力",
      "海外节点流量套餐有限"
    ],
    "bestPractices": [
      "首次开通走 image 模板减少手动安装",
      "快照 + 备份双保险",
      "与 COS / CDN 配套用降成本",
      "sshd / fail2ban 必装"
    ],
    "antiPatterns": [
      "当生产 K8s / 高可用使用",
      "不开快照直接升级被坑",
      "把同一套餐多业务挤一台",
      "默认密码不改"
    ],
    "resources": [
      {
        "title": "腾讯云 Lighthouse 文档",
        "url": "https://cloud.tencent.com/document/product/1207",
        "type": "doc"
      },
      {
        "title": "Lighthouse vs CVM",
        "url": "https://cloud.tencent.com/document/product/1207/45449",
        "type": "doc"
      },
      {
        "title": "腾讯云控制台",
        "url": "https://console.cloud.tencent.com/lighthouse",
        "type": "doc"
      }
    ],
    "maturityLevels": {
      "junior": "能开通 + SSH 部署应用",
      "mid": "能落地快照备份 + 自动化部署",
      "senior": "能驱动多区域 + 套餐选型策略"
    }
  }
}
