{
  "$schema": "../schema/atomic-skill-v1.json",
  "id": "vector-search",
  "type": "atomic-skill",
  "version": "1.0.0",
  "metadata": {
    "name": "Vector Search",
    "nameZh": "向量检索",
    "description": "Configure ANN index, query and reranking for low-latency semantic retrieval.",
    "descriptionZh": "为低延迟语义检索配置 ANN 索引、查询与重排策略。",
    "author": "skills4coder-team",
    "tags": ["vector", "ann", "retrieval", "rag"],
    "category": "ai-llm"
  },
  "input": {
    "schema": {
      "type": "object",
      "properties": {
        "vectorDB": { "enum": ["pgvector", "qdrant", "weaviate", "pinecone", "milvus"] },
        "scale": { "type": "string", "description": "向量数量级" },
        "latencyBudget": { "type": "string", "description": "P95 延迟预算" },
        "filters": { "type": "array", "items": { "type": "string" } }
      },
      "required": ["vectorDB"]
    }
  },
  "output": {
    "schema": {
      "type": "object",
      "properties": {
        "indexConfig": { "type": "object" },
        "queryPlan": { "type": "object" },
        "rerankerConfig": { "type": "object" }
      }
    }
  },
  "implementation": {
    "type": "native",
    "function": "vector_search"
  },
  "constraints": {
    "permissions": ["read", "write"]
  },
  "errors": {
    "INDEX_NOT_BUILT": { "code": "VS_001", "message": "目标向量集尚未建索引", "retryable": false },
    "FILTER_INCOMPATIBLE": { "code": "VS_002", "message": "过滤条件无法被当前索引高效执行", "retryable": false }
  },
  "learning": {
    "summaryZh": "向量检索是 RAG 的入口，召回率/延迟/过滤能力的取舍决定整体体验。",
    "keyPoints": [
      "ANN 主流算法：HNSW（高召回低延迟）vs IVF-PQ（低内存大规模）",
      "metric 选择：cosine 用于规范化向量，dot product / L2 用于未规范化",
      "Hybrid search = 关键词（BM25）+ 向量，比单一向量更稳",
      "Reranking（cross-encoder）显著提升 top-k 精度，代价是延迟",
      "元数据过滤要前置（pre-filter）或后置（post-filter）依据基数权衡",
      "batch 查询与连接池是吞吐关键"
    ],
    "bestPractices": [
      "先用 BM25 + 向量混合，必要时加 reranker，避免一上来就追求复杂方案",
      "为高基数过滤字段建索引或用分区，避免全表扫",
      "监控召回@k、nDCG、查询延迟 P95/P99",
      "向量与原文分离存储，原文用对象存储，向量库只存 metadata + id",
      "做 query 改写（HyDE / multi-query）提升模糊问题召回"
    ],
    "antiPatterns": [
      "把全文塞进 vector DB 的 payload，导致存储爆炸",
      "只看 top-1 结果，没有 reranking",
      "filter 条件过滤掉 99% 文档但仍走全量 ANN，浪费",
      "线上随意改 embedding 模型却不重建索引",
      "对 ID 类精确查询也走向量检索"
    ],
    "resources": [
      { "title": "pgvector", "url": "https://github.com/pgvector/pgvector", "type": "tool" },
      { "title": "Qdrant Docs", "url": "https://qdrant.tech/documentation/", "type": "doc" },
      { "title": "HNSW Paper (Malkov & Yashunin)", "url": "https://arxiv.org/abs/1603.09320", "type": "article" },
      { "title": "Hybrid Search (Weaviate)", "url": "https://weaviate.io/blog/hybrid-search-explained", "type": "article" },
      { "title": "Reranking with Cohere", "url": "https://docs.cohere.com/docs/reranking", "type": "doc" }
    ],
    "maturityLevels": {
      "junior": "能调用 vector DB API 完成 top-k 查询",
      "mid": "能选择合适索引算法、设计 hybrid + reranker 流水线",
      "senior": "能在 P99 延迟预算下设计大规模、多租户向量检索系统"
    }
  }
}
