{
  "$schema": "../schema/atomic-skill-v1.json",
  "id": "vulnerability-assessment",
  "type": "atomic-skill",
  "version": "1.0.0",
  "metadata": {
    "name": "Vulnerability Assessment",
    "nameZh": "vulnerability-assessment",
    "description": "Skill: vulnerability-assessment",
    "descriptionZh": "vulnerability-assessment",
    "author": "skills4coder-team",
    "tags": [
      "vulnerability"
    ],
    "category": "atomic"
  },
  "input": {
    "schema": {
      "type": "object",
      "properties": {},
      "required": []
    }
  },
  "output": {
    "schema": {
      "type": "object",
      "properties": {},
      "required": []
    }
  },
  "implementation": {
    "type": "native",
    "function": "vulnerability_assessment"
  },
  "errors": {}
}