{
  "$schema": "../schema/atomic-skill-v1.json",
  "id": "docker-exec",
  "type": "atomic-skill",
  "version": "1.0.0",
  "metadata": {
    "name": "Docker Exec",
    "nameZh": "Docker 容器执行",
    "description": "Execute a command inside a running Docker container",
    "descriptionZh": "在运行中的 Docker 容器内执行命令",
    "author": "skills4coder-team",
    "tags": [
      "docker",
      "container",
      "exec",
      "ops"
    ],
    "category": "container"
  },
  "input": {
    "schema": {
      "type": "object",
      "properties": {
        "container": {
          "type": "string",
          "description": "容器名称或 ID"
        },
        "command": {
          "type": "string",
          "description": "要执行的命令"
        },
        "workdir": {
          "type": "string",
          "description": "容器内工作目录"
        },
        "user": {
          "type": "string",
          "description": "执行用户（默认 root）"
        },
        "timeout": {
          "type": "number",
          "default": 30000,
          "description": "超时时间（毫秒）"
        }
      },
      "required": [
        "container",
        "command"
      ]
    }
  },
  "output": {
    "schema": {
      "type": "object",
      "properties": {
        "stdout": {
          "type": "string",
          "description": "标准输出"
        },
        "stderr": {
          "type": "string",
          "description": "标准错误"
        },
        "exitCode": {
          "type": "number",
          "description": "退出码"
        }
      },
      "required": [
        "stdout",
        "stderr",
        "exitCode"
      ]
    }
  },
  "implementation": {
    "type": "native",
    "function": "dockerExec",
    "module": "internal/docker-client"
  },
  "constraints": {
    "permissions": [
      "read",
      "exec"
    ],
    "allowedCommands": [
      "docker exec"
    ],
    "blockedContainerPaths": [
      "/etc/shadow",
      "/proc/1/environ"
    ],
    "timeout": 60000,
    "maxOutputSize": 10485760
  },
  "errors": {
    "CONTAINER_NOT_FOUND": {
      "code": "E501",
      "message": "容器不存在或未运行",
      "retryable": false
    },
    "EXEC_FAILED": {
      "code": "E502",
      "message": "容器内命令执行失败",
      "retryable": false
    },
    "TIMEOUT": {
      "code": "E503",
      "message": "执行超时",
      "retryable": true
    }
  },
  "learning": {
    "summaryZh": "在容器里跑命令是 agent 隔离危险动作的首选沙箱，但配置错了反而是最大攻击面。",
    "keyPoints": [
      "默认非 root（USER 1000），禁用 --privileged",
      "只挂载必要 volume，禁挂 docker.sock 与 / 根目录",
      "设资源限制：--cpus / --memory / --pids-limit",
      "网络默认 none 或专属 bridge，按需开放",
      "执行前 image digest 锁定，避免 latest tag 被偷换"
    ],
    "bestPractices": [
      "为每次 exec 创建一次性容器（--rm），不复用",
      "使用 read-only 文件系统 + tmpfs /tmp",
      "Capabilities drop ALL，按需 add",
      "采集容器 stdout/stderr 到统一日志，不落容器内",
      "为高危镜像跑 trivy / grype 扫漏洞"
    ],
    "antiPatterns": [
      "挂 -v /:/host 直接逃逸",
      "--privileged + --network host 给 agent，等同裸跑",
      "镜像用 :latest，无版本固定",
      "一个容器里跑多个 exec，状态污染",
      "把 secrets 通过 ENV 传入并 docker inspect 暴露"
    ],
    "resources": [
      {
        "title": "Docker security best practices",
        "url": "https://docs.docker.com/engine/security/",
        "type": "doc"
      },
      {
        "title": "CIS Docker Benchmark",
        "url": "https://www.cisecurity.org/benchmark/docker",
        "type": "doc"
      },
      {
        "title": "gVisor: container sandbox",
        "url": "https://gvisor.dev/",
        "type": "doc"
      }
    ],
    "maturityLevels": {
      "junior": "能 docker run 跑命令、理解 -v / -e / --rm 含义",
      "mid": "能配置非 root、资源限制、capabilities drop、image 锁定",
      "senior": "能为 agent 平台设计容器沙箱体系：镜像扫描 / runtime 加固 / 逃逸检测 / 配额治理"
    }
  }
}
