{
  "$schema": "../schema/atomic-skill-v1.json",
  "id": "cross-platform",
  "type": "atomic-skill",
  "version": "1.0.0",
  "metadata": {
    "name": "Cross-Platform Compatibility",
    "nameZh": "跨平台兼容",
    "description": "Ensure feature works consistently across iOS/Android/Web/Desktop targets with shared business logic and platform-specific UI.",
    "descriptionZh": "保证功能在 iOS / Android / Web / 桌面端表现一致，共享业务逻辑、按平台落 UI 与交互细节。",
    "author": "skills4coder-team",
    "tags": [
      "mobile",
      "cross-platform",
      "react-native",
      "flutter",
      "kmp"
    ],
    "category": "mobile"
  },
  "input": {
    "schema": {
      "type": "object",
      "required": [
        "feature",
        "targets"
      ],
      "properties": {
        "feature": {
          "type": "string"
        },
        "targets": {
          "type": "array",
          "items": {
            "enum": [
              "ios",
              "android",
              "web",
              "desktop"
            ]
          }
        },
        "framework": {
          "enum": [
            "react-native",
            "flutter",
            "kmp",
            "native"
          ],
          "default": "react-native"
        }
      }
    }
  },
  "output": {
    "schema": {
      "type": "object",
      "properties": {
        "platformDeltas": {
          "type": "object"
        },
        "sharedModules": {
          "type": "array"
        },
        "compatibilityMatrix": {
          "type": "object"
        }
      }
    }
  },
  "implementation": {
    "type": "native",
    "function": "cross_platform"
  },
  "errors": {
    "PLATFORM_API_MISSING": {
      "code": "XP_001",
      "message": "目标平台缺少所需 API",
      "retryable": false
    },
    "UI_CONVENTION_CLASH": {
      "code": "XP_002",
      "message": "与平台 HIG / Material 规范冲突",
      "retryable": false
    }
  },
  "constraints": {
    "permissions": [
      "read"
    ]
  },
  "learning": {
    "summaryZh": "跨平台不是\"一次开发到处运行\"，而是\"共享逻辑 + 平台原生体验\"。",
    "keyPoints": [
      "业务逻辑 / 数据层共享，UI 层差异化",
      "尊重平台 HIG / Material Design",
      "原生模块桥接处是性能瓶颈",
      "版本碎片化（Android）需 minSDK 策略",
      "CI 矩阵覆盖关键 OS 版本"
    ],
    "bestPractices": [
      "用 KMP / RN / Flutter 各有取舍，按团队栈选",
      "关键路径写各平台 e2e（Detox / XCUITest）",
      "原生模块走 typed bridge",
      "灰度先小流量观察"
    ],
    "antiPatterns": [
      "套同一套 UI 强求一致",
      "在桥接处频繁大对象传输",
      "忽视平台权限差异（iOS ATS / Android Scoped Storage）",
      "一个分支适配所有 OS 版本"
    ],
    "resources": [
      {
        "title": "React Native New Architecture",
        "url": "https://reactnative.dev/architecture/landing-page",
        "type": "doc"
      },
      {
        "title": "Flutter Platform Channels",
        "url": "https://docs.flutter.dev/platform-integration/platform-channels",
        "type": "doc"
      },
      {
        "title": "KMP Multiplatform docs",
        "url": "https://kotlinlang.org/docs/multiplatform.html",
        "type": "doc"
      }
    ],
    "maturityLevels": {
      "junior": "能在跨平台框架内开发常规页面",
      "mid": "能写原生桥接、处理平台差异",
      "senior": "能为跨平台架构选型、性能调优、灰度策略"
    }
  }
}
