{
  "$schema": "../schema/atomic-skill-v1.json",
  "id": "mcp-server-development",
  "type": "atomic-skill",
  "version": "1.0.0",
  "metadata": {
    "name": "MCP Server Development",
    "nameZh": "MCP 服务器开发",
    "description": "Design and implement Model Context Protocol servers that expose tools, resources, and prompts to LLM agents.",
    "descriptionZh": "设计并实现 Model Context Protocol（MCP）服务器，向 LLM Agent 暴露工具、资源与提示。",
    "author": "skills-database-team",
    "tags": ["mcp", "agent", "llm", "tool-use", "protocol"],
    "category": "ai-llm"
  },
  "input": {
    "schema": {
      "type": "object",
      "properties": {
        "tools": { "type": "array", "items": { "type": "object" }, "description": "待暴露的工具列表（name/description/inputSchema）" },
        "resources": { "type": "array", "items": { "type": "object" }, "description": "待暴露的资源（URI 模板/静态）" },
        "transport": { "enum": ["stdio", "sse", "websocket"], "description": "传输协议选择" },
        "authScheme": { "type": "string", "description": "认证方案（none/api-key/oauth）" }
      },
      "required": ["tools"]
    }
  },
  "output": {
    "schema": {
      "type": "object",
      "properties": {
        "serverCode": { "type": "string", "description": "MCP 服务器实现代码" },
        "toolManifest": { "type": "object", "description": "工具 JSON Schema 清单" },
        "testCases": { "type": "array", "items": { "type": "object" } },
        "deployConfig": { "type": "object", "description": "部署配置（Docker/npm 包/Claude Desktop config）" }
      }
    }
  },
  "implementation": {
    "type": "native",
    "function": "mcp_server_development"
  },
  "constraints": {
    "permissions": ["read", "write", "network"],
    "blockedPaths": [],
    "notes": "工具实现应遵循最小权限原则；避免在 MCP 工具内部执行不可撤销的写操作"
  },
  "errors": {
    "SCHEMA_INVALID": { "code": "MCP_001", "message": "工具 inputSchema 不符合 JSON Schema Draft 7", "retryable": false },
    "TRANSPORT_MISMATCH": { "code": "MCP_002", "message": "传输协议与宿主客户端不兼容", "retryable": true },
    "TOOL_TIMEOUT": { "code": "MCP_003", "message": "工具执行超时，超出 MCP 默认 30s 限制", "retryable": true },
    "AUTH_FAILURE": { "code": "MCP_004", "message": "认证令牌无效或已过期", "retryable": true }
  },
  "learning": {
    "summaryZh": "MCP 是连接 LLM 与外部世界的标准协议，服务器质量直接决定 Agent 的工具调用可靠性。",
    "keyPoints": [
      "MCP 三大原语：Tools（可调用）、Resources（可读）、Prompts（可重用提示模板）",
      "传输层：stdio 适合本地进程，SSE/WebSocket 适合远程服务",
      "工具 inputSchema 必须精确——LLM 依赖它推断如何调用",
      "每个工具应单一职责，名称与描述要对 LLM 友好（不是对人类友好）",
      "MCP 服务器应无状态或支持会话隔离，避免跨用户状态泄漏",
      "版本化工具 schema：破坏性变更需升级版本号",
      "安全边界：验证所有输入，防止 prompt 注入借助工具提权"
    ],
    "bestPractices": [
      "先用官方 MCP Inspector 调试，确认工具可被正确发现与调用",
      "工具描述中写清触发条件而非实现细节（'Use when you need to…'）",
      "对副作用工具（write/delete）在描述中明确标注并添加确认机制",
      "用 zod/JSON Schema 严格验证输入，不信任 LLM 生成的参数",
      "在 CI 中跑 MCP conformance tests，防止 schema 漂移",
      "提供 Claude Desktop / Cursor 的即插即用配置示例"
    ],
    "antiPatterns": [
      "工具 description 写给人看而非写给模型看，导致模型不知道何时调用",
      "一个工具做太多事（create_and_update_and_delete），违反单一职责",
      "不做输入校验，任意字符串流入底层命令执行",
      "工具执行时间过长（>30s）却不提供流式或异步机制",
      "不提供错误消息，LLM 无法根据失败原因重试或回退"
    ],
    "resources": [
      { "title": "Model Context Protocol Spec", "url": "https://modelcontextprotocol.io/docs", "type": "doc" },
      { "title": "MCP TypeScript SDK", "url": "https://github.com/modelcontextprotocol/typescript-sdk", "type": "tool" },
      { "title": "MCP Python SDK", "url": "https://github.com/modelcontextprotocol/python-sdk", "type": "tool" },
      { "title": "MCP Inspector", "url": "https://github.com/modelcontextprotocol/inspector", "type": "tool" },
      { "title": "Anthropic MCP Introduction", "url": "https://www.anthropic.com/news/model-context-protocol", "type": "article" }
    ],
    "maturityLevels": {
      "junior": "能基于 SDK 示例实现一个简单工具服务器并在 Claude Desktop 中验证",
      "mid": "能设计多工具、有认证、有错误处理的生产级 MCP 服务器并发布为 npm/PyPI 包",
      "senior": "能设计 MCP 服务器的安全边界、版本策略与大规模工具注册中心"
    }
  }
}
