{
  "$schema": "../schema/atomic-skill-v1.json",
  "id": "container-image-scanning",
  "type": "atomic-skill",
  "version": "1.0.0",
  "metadata": {
    "name": "Container Image Scanning",
    "nameZh": "container-image-scanning",
    "description": "Skill: container-image-scanning",
    "descriptionZh": "container-image-scanning",
    "author": "skills4coder-team",
    "tags": [
      "container"
    ],
    "category": "atomic"
  },
  "input": {
    "schema": {
      "type": "object",
      "properties": {},
      "required": []
    }
  },
  "output": {
    "schema": {
      "type": "object",
      "properties": {},
      "required": []
    }
  },
  "implementation": {
    "type": "native",
    "function": "container_image_scanning"
  },
  "errors": {}
}