{
  "$schema": "../schema/atomic-skill-v1.json",
  "id": "storage-security",
  "type": "atomic-skill",
  "version": "1.0.0",
  "metadata": {
    "name": "Storage Security",
    "nameZh": "storage-security",
    "description": "Skill: storage-security",
    "descriptionZh": "storage-security",
    "author": "skills4coder-team",
    "tags": [
      "storage"
    ],
    "category": "atomic"
  },
  "input": {
    "schema": {
      "type": "object",
      "properties": {},
      "required": []
    }
  },
  "output": {
    "schema": {
      "type": "object",
      "properties": {},
      "required": []
    }
  },
  "implementation": {
    "type": "native",
    "function": "storage_security"
  },
  "errors": {}
}