{
  "$schema": "../schema/atomic-skill-v1.json",
  "id": "component-design",
  "type": "atomic-skill",
  "version": "1.1.0",
  "metadata": {
    "name": "Component Design",
    "nameZh": "组件设计",
    "description": "Design reusable, accessible, and composable UI components with clear API boundaries.",
    "descriptionZh": "设计可复用、可访问、可组合的 UI 组件，明确 API 边界、状态归属与样式策略。",
    "author": "skills4coder-team",
    "tags": ["frontend", "component", "design-system", "a11y", "ui"],
    "category": "frontend"
  },
  "input": {
    "schema": {
      "type": "object",
      "properties": {
        "componentName": { "type": "string" },
        "purpose": { "type": "string", "description": "组件解决的问题" },
        "variants": { "type": "array", "items": { "type": "string" } },
        "stateOwnership": { "enum": ["controlled", "uncontrolled", "hybrid"] },
        "a11yLevel": { "enum": ["AA", "AAA"], "default": "AA" }
      },
      "required": ["componentName", "purpose"]
    }
  },
  "output": {
    "schema": {
      "type": "object",
      "properties": {
        "componentCode": { "type": "string" },
        "propsApi": { "type": "string" },
        "stories": { "type": "string", "description": "Storybook 用例" },
        "tests": { "type": "string" },
        "a11yReport": { "type": "string" }
      }
    }
  },
  "implementation": {
    "type": "native",
    "function": "component_design"
  },
  "constraints": {
    "permissions": ["read", "write"],
    "allowedExtensions": [".tsx", ".jsx", ".vue", ".svelte", ".css", ".scss", ".stories.tsx"]
  },
  "errors": {
    "AMBIGUOUS_API": { "code": "COMP_001", "message": "Props API 命名或语义有歧义", "retryable": false },
    "A11Y_VIOLATION": { "code": "COMP_002", "message": "未满足无障碍要求", "retryable": false }
  },
  "learning": {
    "summaryZh": "好组件 = 单一职责 + 清晰 props + 无副作用 + 可访问 + 可组合。",
    "keyPoints": [
      "单一职责：一个组件只解决一个 UI 问题；功能聚合到容器层而非展示层",
      "受控 vs 非受控：默认非受控，必要时升级为受控；不要二者并存",
      "Props 设计：布尔标志 < 5 个，多于则用枚举或 slot；避免 `mode='special-edit-with-...'` 这种字符串黑魔法",
      "组合优于配置：用 `Card.Header / Card.Body` slot 模式而非 `<Card hasHeader headerProps={...}>`",
      "样式策略一致：CSS Variable / token 驱动主题，不要硬编码颜色",
      "无障碍：键盘可达 + 焦点环 + ARIA 角色 + 颜色对比度 > 4.5:1",
      "性能：受控组件用 React.memo + useMemo/useCallback；列表用虚拟滚动"
    ],
    "bestPractices": [
      "API-first：先写 README + 用法示例再写实现，倒逼接口清晰",
      "用 Storybook 覆盖所有 variant + state（hover/focus/disabled/loading/error）",
      "做视觉回归（Chromatic / Loki），防止样式回退",
      "用 axe-core / pa11y 做无障碍 CI 检查",
      "分离 headless（行为）+ skin（样式）层，参考 Radix UI / Headless UI"
    ],
    "antiPatterns": [
      "一个组件 30+ props 还在涨",
      "在组件内部 fetch 数据，破坏纯展示性",
      "state 同时受控也被内部修改，行为不可预测",
      "用 div + onClick 模拟 button，丢失键盘和无障碍",
      "通过 className 注入业务样式，破坏组件封装"
    ],
    "resources": [
      { "title": "Refactoring UI (Adam Wathan)", "url": "https://www.refactoringui.com/", "type": "book" },
      { "title": "Radix UI Primitives", "url": "https://www.radix-ui.com/", "type": "tool" },
      { "title": "WAI-ARIA Authoring Practices", "url": "https://www.w3.org/WAI/ARIA/apg/", "type": "doc" },
      { "title": "Storybook Docs", "url": "https://storybook.js.org/docs", "type": "doc" },
      { "title": "Inclusive Components (Heydon Pickering)", "url": "https://inclusive-components.design/", "type": "book" }
    ],
    "maturityLevels": {
      "junior": "能在 design system 内实现常见组件，遵循既有 props 规范",
      "mid": "能设计中等复杂度组件 API、覆盖 a11y 与全状态用例",
      "senior": "能主导 design system / 组件库架构，建立 API 设计原则与治理流程"
    }
  }
}
