{
  "$schema": "../schema/atomic-skill-v1.json",
  "id": "compliance",
  "type": "atomic-skill",
  "version": "1.0.0",
  "metadata": {
    "name": "Compliance",
    "nameZh": "compliance",
    "description": "Skill: compliance",
    "descriptionZh": "compliance",
    "author": "skills4coder-team",
    "tags": [
      "compliance"
    ],
    "category": "atomic"
  },
  "input": {
    "schema": {
      "type": "object",
      "properties": {},
      "required": []
    }
  },
  "output": {
    "schema": {
      "type": "object",
      "properties": {},
      "required": []
    }
  },
  "implementation": {
    "type": "native",
    "function": "compliance"
  },
  "errors": {}
}